<?xml version="1.0" encoding="UTF-8" ?>
<Clients xmlns="http://it.by/zaliashchonak/xmlschema"
         xmlns:xsi="http://www.w3.org/2001/XMLSchema-instance"
         xsi:schemaLocation="http://it.by/zaliashchonak/xmlschema Schema.xsd">
    <Client>
        <Nickname>Вася1</Nickname>
        <Password>Пароль1</Password>
        <Email>mail1@gmail.com</Email>
        <Ads>
            <Ad>
                <Product>Product1</Product>
                <Price currency="BYN">1000</Price>
                <Description>Product1 Description</Description>
            </Ad>
            <Ad>
                <Product>Product2</Product>
                <Price currency="BYN">2000</Price>
                <Description>Product2 Description</Description>
            </Ad>
        </Ads>
    </Client>
    <Client>
        <Nickname>Вася2</Nickname>
        <Password>Пароль2</Password>
        <Email>mail2@gmail.com</Email>
        <Ads>
            <Ad>
                <Product>Product3</Product>
                <Price currency="BYN">3000</Price>
                <Description>Product3 Description</Description>
            </Ad>
        </Ads>
    </Client>
</Clients>